title,url,extra,for_twitter
Tuition Attendance And Students With Mental Health Disability: Does Widening Tuition Options Increase Access?,(https://www.tandfonline.com/doi/pdf/10.1080/02680513.2021.1999801,"
K Smith, D Smith - Open Learning: The Journal of Open, Distance and e …,
2021

",Tuition Attendance And Students With Mental Health Disability: Does Widening Tuition Options Increase Access?   (https://www.tandfonline.com/doi/pdf/10.1080/02680513.2021.1999801
Determinants Of Research Productivity During Postgraduate Medical Education: A Structured Review,(https://link.springer.com/article/10.1186/s12909-021-03010-1,"KB
Laupland, F Edwards, J Dhanani - BMC Medical Education, 2021

",Determinants Of Research Productivity During Postgraduate Medical Education: A Structured Review   (https://link.springer.com/article/10.1186/s12909-021-03010-1
Dyslexia In Dentistry: Recommendations To Support Dental Professionals And Students With Dyslexia,(https://www.nature.com/articles/s41415-021-3607-6,"L Maybin, D
Keshani - British Dental Journal, 2021

",Dyslexia In Dentistry: Recommendations To Support Dental Professionals And Students With Dyslexia   (https://www.nature.com/articles/s41415-021-3607-6
