title,url,extra,for_twitter
"Facilitators’ Engagement In Advocacy Towards Inclusion Of Adults With Disabilities In The Literacy Training Program In Gedeo Zone, Ethiopia",(https://www.hindawi.com/journals/edri/2021/5353652/,"D
Matsana, D Negassa, Y Seyoum, A Tekle - Education Research
International, 2021

","Facilitators’ Engagement In Advocacy Towards Inclusion Of Adults With Disabilities In The Literacy Training Program In Gedeo Zone, Ethiopia   (https://www.hindawi.com/journals/edri/2021/5353652/"
Disability As Diversity: Rethinking Resilience For Individuals With Intellectual And Developmental Disabilities And Families,(https://link.springer.com/chapter/10.1007/978-3-030-81277-5_1,"
JL Jones, KL Gallus - Belonging and Resilience in Individuals with …,
2021

",Disability As Diversity: Rethinking Resilience For Individuals With Intellectual And Developmental Disabilities And Families   (https://link.springer.com/chapter/10.1007/978-3-030-81277-5_1
