title,url,extra,for_twitter
Improving Health Care Accessibility For People With Vision Impairment—A Call To Account,(https://jamanetwork.com/journals/jamaophthalmology/article-abstract/2786929,"
J Ramke, BAMA Tong, BK Swenor - JAMA ophthalmology, 2021

",Improving Health Care Accessibility For People With Vision Impairment—A Call To Account   (https://jamanetwork.com/journals/jamaophthalmology/article-abstract/2786929
Creating A Culture Of Diversity And Inclusion In India Inc.: An Introduction,(https://link.springer.com/chapter/10.1007/978-981-16-4237-1_1,"
K Sen - Creating a Culture of Diversity and Inclusiveness in …, 2021

",Creating A Culture Of Diversity And Inclusion In India Inc.: An Introduction   (https://link.springer.com/chapter/10.1007/978-981-16-4237-1_1
Disability Content In The Journal Of Counseling And Development And Social Work: A Comparative Analysis,(https://journals.sagepub.com/doi/abs/10.1177/00343552211063245,"
CE Degeneffe, H Doty, R Martinez, N Ncube, N Nguyen - Rehabilitation
Counseling …, 2021

",Disability Content In The Journal Of Counseling And Development And Social Work: A Comparative Analysis   (https://journals.sagepub.com/doi/abs/10.1177/00343552211063245
Diversity And Inclusion—A Key Business Strategy,(https://link.springer.com/chapter/10.1007/978-981-16-4237-1_3,"
N Mitra, K Mehta - Creating a Culture of Diversity and Inclusiveness
in …, 2021

",Diversity And Inclusion—A Key Business Strategy   (https://link.springer.com/chapter/10.1007/978-981-16-4237-1_3
Women Who Commit Hate-Motivated Violence: Advancing A Gendered Understanding Of Hate Crime,(https://www.sciencedirect.com/science/article/pii/S0049089X21001599,"
B Lantz - Social Science Research, 2021

",Women Who Commit Hate-Motivated Violence: Advancing A Gendered Understanding Of Hate Crime   (https://www.sciencedirect.com/science/article/pii/S0049089X21001599
Development Studies In The World System Of Global Knowledge Production: A Critical Empirical Analysis,(https://journals.sagepub.com/doi/abs/10.1177/14649934211060155,"
M Demeter - Progress in Development Studies, 2021

",Development Studies In The World System Of Global Knowledge Production: A Critical Empirical Analysis   (https://journals.sagepub.com/doi/abs/10.1177/14649934211060155
Diversity And Disparities In Research Studies And Career Trajectories In Psychiatry,(https://www.sciencedirect.com/science/article/pii/S0165178121006284,"
K Crittenden-Ward, M Micaletto, J Olt, ZC Tackett… - Psychiatry
Research, 2021

",Diversity And Disparities In Research Studies And Career Trajectories In Psychiatry   (https://www.sciencedirect.com/science/article/pii/S0165178121006284
Factor Structure Of The Brief-P Teacher Version In A Sample Of Bosnian Preschool Children With Intellectual Disability,(https://www.tandfonline.com/doi/abs/10.1080/09297049.2021.2008338,"
H Memisevic, D Malec, A Pasalic - Child Neuropsychology, 2021

",Factor Structure Of The Brief-P Teacher Version In A Sample Of Bosnian Preschool Children With Intellectual Disability   (https://www.tandfonline.com/doi/abs/10.1080/09297049.2021.2008338
Gender Gaps In Cognitive And Noncognitive Skills Among Adolescents In India,(https://www.sciencedirect.com/science/article/pii/S0167268121004789,"
J Hervé, S Mani, JR Behrman, A Nandi, AS Lamkang… - Journal of
Economic …, 2022

",Gender Gaps In Cognitive And Noncognitive Skills Among Adolescents In India   (https://www.sciencedirect.com/science/article/pii/S0167268121004789
