title,url,extra,for_twitter
An Integration-And-Learning Perspective On Gender Diversity In Self-Managing Teams: The Roles Of Learning Goal Orientation And Shared Leadership.,https://psycnet.apa.org/record/2021-87926-001,"
Y Li, J Koopmann, K Lanaj, JR Hollenbeck - Journal of Applied
Psychology, 2021

",An Integration-And-Learning Perspective On Gender Diversity In Self-Managing Teams: The Roles Of Learning Goal Orientation And Shared Leadership.   https://psycnet.apa.org/record/2021-87926-001
"Cognitive Processes Behind The Shooter Bias: Dissecting Response Bias, Motor Preparation And Information Accumulation",https://psyarxiv.com/eagwt/download,"
M Frenken, W Hemmerich, D Izydorczyk, S Scharf… - 2021

","Cognitive Processes Behind The Shooter Bias: Dissecting Response Bias, Motor Preparation And Information Accumulation   https://psyarxiv.com/eagwt/download"
Surgical Research Journals-Under Review: An Assessment Of Diversity Among Editorial Boards And Outcomes Of Peer Review,https://www.sciencedirect.com/science/article/pii/S0002961021005535,"
EM White, RC Maduka, D Ballouz, H Chen, SD Wexner… - The American
Journal of …, 2021

",Surgical Research Journals-Under Review: An Assessment Of Diversity Among Editorial Boards And Outcomes Of Peer Review   https://www.sciencedirect.com/science/article/pii/S0002961021005535
A Critical Race Theory Test Of Web Dubois’ Hypothesis: Do Black Students Need Separate Schools?,https://www.tandfonline.com/doi/abs/10.1080/13613324.2021.1984099,"
TJ Yosso, WA Smith, DG Solórzano, M Hung - Race Ethnicity and Education,
2021

",A Critical Race Theory Test Of Web Dubois’ Hypothesis: Do Black Students Need Separate Schools?   https://www.tandfonline.com/doi/abs/10.1080/13613324.2021.1984099
The Need To Recognize And Reward Academic Service,https://www.nature.com/articles/s41578-021-00383-z,"
AM Armani, C Jackson, TA Searles, J Wade - Nature Reviews Materials,
2021

",The Need To Recognize And Reward Academic Service   https://www.nature.com/articles/s41578-021-00383-z
Biased Face Recognition Technology Used By Government: A Problem For Liberal Democracy,https://link.springer.com/article/10.1007/s13347-021-00478-z,"
M Gentzel - Philosophy & Technology, 2021

",Biased Face Recognition Technology Used By Government: A Problem For Liberal Democracy   https://link.springer.com/article/10.1007/s13347-021-00478-z
Increasing Disability Inclusion In Health Programming Using Nchpad’s Inclusive Community Implementation Process: A Case Study,https://www.sciencedirect.com/science/article/pii/S0003999321009205,"
C Herman, Y Eisenberg - Archives of Physical Medicine and
Rehabilitation, 2021

",Increasing Disability Inclusion In Health Programming Using Nchpad’s Inclusive Community Implementation Process: A Case Study   https://www.sciencedirect.com/science/article/pii/S0003999321009205
Ten Simple Rules For Choosing A Phd Supervisor,https://journals.plos.org/ploscompbiol/article%3Fid%3D10.1371/journal.pcbi.1009330,"
L Jabre, C Bannon, JSP McCain, Y Eglit - 2021

",Ten Simple Rules For Choosing A Phd Supervisor   https://journals.plos.org/ploscompbiol/article%3Fid%3D10.1371/journal.pcbi.1009330
