title,url,extra,for_twitter
Meet The Needs Of Students Of Size,(https://onlinelibrary.wiley.com/doi/abs/10.1002/dhe.31219,"J
Hope - Disability Compliance for Higher Education, 2022

",Meet The Needs Of Students Of Size   (https://onlinelibrary.wiley.com/doi/abs/10.1002/dhe.31219
Design And Implementation Of Smart Wheelchair For Disabled/Elderly People,(https://link.springer.com/chapter/10.1007/978-3-030-91244-4_33,"
MF Ma’ruf, GW Pradana, DF Eprlianto, S Megawati - International Joint
Conference …, 2021

",Design And Implementation Of Smart Wheelchair For Disabled/Elderly People   (https://link.springer.com/chapter/10.1007/978-3-030-91244-4_33
"Pan-Africanism And Psychology: Resistance, Liberation, And Decoloniality",(https://link.springer.com/chapter/10.1007/978-3-030-89351-4_1,"
L Simon, J Feierabend-Peters, H Silk, CM Rasmussen…

","Pan-Africanism And Psychology: Resistance, Liberation, And Decoloniality   (https://link.springer.com/chapter/10.1007/978-3-030-89351-4_1"
