title,url,extra,for_twitter
Child Case Studies: Leading The Way To Inclusion,(https://www.sciencedirect.com/science/article/pii/S0742051X21003437,"
N Alborno - Teaching and Teacher Education, 2022

",Child Case Studies: Leading The Way To Inclusion   (https://www.sciencedirect.com/science/article/pii/S0742051X21003437
Determinants Of Gender Disparity In Nutritional Intake Among Children In Pakistan: Evidence From Pdhs,(https://www.mdpi.com/2227-9067/9/1/7/pdf,"Y Wang, M Qian, AN
Nabbijohn, F Wen, G Fu, B Zuo… - Developmental Science

",Determinants Of Gender Disparity In Nutritional Intake Among Children In Pakistan: Evidence From Pdhs   (https://www.mdpi.com/2227-9067/9/1/7/pdf
