title,url,extra,for_twitter
"Intersections Of Gender, Ethnicity, Place And Innovation: Mapping The Diversity Of Women-Led Smes In The United Kingdom",(https://journals.sagepub.com/doi/pdf/10.1177/0266242620981877,"
B Owalla, E Nyanzu, T Vorley - International Small Business Journal,
2021





","Intersections Of Gender, Ethnicity, Place And Innovation: Mapping The Diversity Of Women-Led Smes In The United Kingdom   (https://journals.sagepub.com/doi/pdf/10.1177/0266242620981877"
Non-White Race/Ethnicity And Female Sex Are Associated With Increased Allogenic Red Blood Cell Transfusion In Cardiac Surgery Patients: 2007 To 2018,(https://www.sciencedirect.com/science/article/pii/S105307702100985X,"
S O’Shaughnessy, V Tangel, S Dzotsi, S Jiang, R White… - Journal of
Cardiothoracic …, 2021

",Non-White Race/Ethnicity And Female Sex Are Associated With Increased Allogenic Red Blood Cell Transfusion In Cardiac Surgery Patients: 2007 To 2018   (https://www.sciencedirect.com/science/article/pii/S105307702100985X
Stem Without Art: A Ship Without A Sail,(https://www.sciencedirect.com/science/article/pii/S1871187121001929,"
CY Liu, CJ Wu - Thinking Skills and Creativity, 2021

",Stem Without Art: A Ship Without A Sail   (https://www.sciencedirect.com/science/article/pii/S1871187121001929
Risk Of Editor Bias,(https://www.nature.com/articles/s41415-021-3688-2.pdf%3Forigin%3Dppub,"
C Faggion Jr - British Dental Journal, 2021

",Risk Of Editor Bias   (https://www.nature.com/articles/s41415-021-3688-2.pdf%3Forigin%3Dppub
