title,url,extra,for_twitter
Do Community-Based Livelihood Interventions Affect Sexual And Reproductive Health And Rights Of Young People In Slum Areas Of Uganda: A Difference-In …,(https://link.springer.com/article/10.1007/s11524-021-00596-1,"
B Wulandari, AN Wulandari - Indonesian Journal of Global Health
Research, 2021

",Do Community-Based Livelihood Interventions Affect Sexual And Reproductive Health And Rights Of Young People In Slum Areas Of Uganda: A Difference-In …   (https://link.springer.com/article/10.1007/s11524-021-00596-1
Adapting The Cacao Model To Support Higher Education Stem Teaching Reform,(https://stemeducationjournal.springeropen.com/articles/10.1186/s40594-021-00325-9,"
Y Lopiz, C García-Fernandez, M Vallejo-Carrasco… - International
Orthopaedics, 2022

",Adapting The Cacao Model To Support Higher Education Stem Teaching Reform   (https://stemeducationjournal.springeropen.com/articles/10.1186/s40594-021-00325-9
Gender And Ethnicity Bias In Medicine: A Text Analysis Of 1.8 Million Critical Care Records,(https://psyarxiv.com/xpb2k/download%3Fformat%3Dpdf,"DM
Markowitz - 2022

",Gender And Ethnicity Bias In Medicine: A Text Analysis Of 1.8 Million Critical Care Records   (https://psyarxiv.com/xpb2k/download%3Fformat%3Dpdf
Racial Bias In Perceptions Of Disease And Policy,(https://journals.sagepub.com/doi/abs/10.1177/13684302211062129,"
X Zhao, ES Fisher, Y Wang, K Zuloaga, L Manley… - Stem Cell Reports,
2022

",Racial Bias In Perceptions Of Disease And Policy   (https://journals.sagepub.com/doi/abs/10.1177/13684302211062129
Racial Disparities Persist In Cancer Screening: New Uspstf Colorectal Cancer Screening Guidelines Illuminate Inadequate Breast Cancer Screening Guidelines For …,(https://link.springer.com/article/10.1007/s11606-021-07368-2,"MI
Brinster, BH Brukilacchio, A Fikki-Urbanovsky… - Journal of Autism
and …, 2022

",Racial Disparities Persist In Cancer Screening: New Uspstf Colorectal Cancer Screening Guidelines Illuminate Inadequate Breast Cancer Screening Guidelines For …   (https://link.springer.com/article/10.1007/s11606-021-07368-2
The Status Of Women In Neolithic & Pre-Imperial China: How Bioarchaeological Evidence Informs Ongoing Debate,(https://www.tandfonline.com/doi/abs/10.1080/00438243.2021.2021108,"
SA Crawford, DN Christifano, EH Kerling, BJ Gajewski… - … , Leukotrienes
and Essential …, 2022

",The Status Of Women In Neolithic & Pre-Imperial China: How Bioarchaeological Evidence Informs Ongoing Debate   (https://www.tandfonline.com/doi/abs/10.1080/00438243.2021.2021108
Gender Distribution Of Scholarship And Measures Of National Recognition In Hospital Medicine,(https://publications.aap.org/hospitalpediatrics/article-abstract/doi/10.1542/hpeds.2021-006278/184458,"
DJ Fox, N Suzuki, V Clark-Bess - Education as the Driving Force of
Equity for the …, 2022

",Gender Distribution Of Scholarship And Measures Of National Recognition In Hospital Medicine   (https://publications.aap.org/hospitalpediatrics/article-abstract/doi/10.1542/hpeds.2021-006278/184458
Are Highly Ranked Dental Journals At Risk Of Editorial Bias? An Examination Of Information On The Reporting Of Peer-Review Practices,(https://www.tandfonline.com/doi/full/10.1080/08989621.2022.2028625,"
Y Cong, K Zheng

",Are Highly Ranked Dental Journals At Risk Of Editorial Bias? An Examination Of Information On The Reporting Of Peer-Review Practices   (https://www.tandfonline.com/doi/full/10.1080/08989621.2022.2028625
Longitudinal Outcomes One Year Following Implicit Bias Training In Medical Students,(https://www.tandfonline.com/doi/abs/10.1080/0142159X.2021.2023120,"
CA LaBrenz, C Reyes-Quilodran, D Padilla-Medina… - International Social
Work, 2022

",Longitudinal Outcomes One Year Following Implicit Bias Training In Medical Students   (https://www.tandfonline.com/doi/abs/10.1080/0142159X.2021.2023120
