title,url,extra,for_twitter
The Gender Responsiveness Of Social Entrepreneurship In Health–A Review Of Initiatives By Ashoka Fellows,(https://www.sciencedirect.com/science/article/pii/S0277953621009977,"

",The Gender Responsiveness Of Social Entrepreneurship In Health–A Review Of Initiatives By Ashoka Fellows   (https://www.sciencedirect.com/science/article/pii/S0277953621009977
Lifelines: A Neuroqueer Politics Of Non-Arrival In An Undergraduate Disability Studies Classroom,(https://www.tandfonline.com/doi/full/10.1080/09518398.2021.2017505,"
TL Williams–corresponding, TL Williams…

",Lifelines: A Neuroqueer Politics Of Non-Arrival In An Undergraduate Disability Studies Classroom   (https://www.tandfonline.com/doi/full/10.1080/09518398.2021.2017505
Overcoming Barriers To Promotion For Women And Underrepresented In Medicine Faculty In Academic Emergency Medicine,(https://onlinelibrary.wiley.com/doi/full/10.1002/emp2.12552,"L
Oh, JA Linden, A Zeidan, B Salhi, PC Lema… - Journal of the American …,
2021

",Overcoming Barriers To Promotion For Women And Underrepresented In Medicine Faculty In Academic Emergency Medicine   (https://onlinelibrary.wiley.com/doi/full/10.1002/emp2.12552
Child Case Studies: Leading The Way To Inclusion,(https://www.sciencedirect.com/science/article/pii/S0742051X21003437,"
N Alborno - Teaching and Teacher Education, 2022

",Child Case Studies: Leading The Way To Inclusion   (https://www.sciencedirect.com/science/article/pii/S0742051X21003437
Determinants Of Gender Disparity In Nutritional Intake Among Children In Pakistan: Evidence From Pdhs,(https://www.mdpi.com/2227-9067/9/1/7/pdf,"Y Wang, M Qian, AN
Nabbijohn, F Wen, G Fu, B Zuo… - Developmental Science

",Determinants Of Gender Disparity In Nutritional Intake Among Children In Pakistan: Evidence From Pdhs   (https://www.mdpi.com/2227-9067/9/1/7/pdf
Detecting Gender-Biased Items In A High-Stakes Language Proficiency Test: Using Rasch Model Measurement,(https://www.inderscienceonline.com/doi/abs/10.1504/IJQRE.2021.119817,"
C Lacave, AI Molina, A García-Holgado… - … International Conference
on …, 2021

",Detecting Gender-Biased Items In A High-Stakes Language Proficiency Test: Using Rasch Model Measurement   (https://www.inderscienceonline.com/doi/abs/10.1504/IJQRE.2021.119817
